"timestamp","descricao","modelo","provedor","historico_chat"
"2026-04-10T19:19:35.366845","qual os beneficios do silobag?

Não encontrei essa informação na base FleetPro.

Verifique se esse tipo de pergunta está no material além da planilha.","llama-3.3-70b-versatile","Groq","HUMAN: Vendedor
AI: ✅ Modo **Vendedor de Balcão** ativado. Pode fazer sua pergunta!
HUMAN: 4488
AI: Não encontrei essa informação na base FleetPro. Verifique se o número está correto ou tente digitar apenas o código da peça. Posso ajudar com mais alguma coisa?
HUMAN: silobolsa
AI: Não encontrei essa informação na base FleetPro.
HUMAN: silo bolsa
AI: Para o silo bolsa, encontramos 5 itens relacionados na nossa base de dados FleetPro. Os números de peça FleetPro para esses itens são:

- `1860DSH` para o SILOBAG IPESA SILO 6 PES
- `1875DSH` para o SILOBAG IPESA SILO 75 REFOR
- `1890DSH` para o SILOBAG IPESA SILO 9 PES REFOR
- `1891DSH` para o SILOBAG IPESA SILO 75 GRAO
- `2952DSH` para o SILOBAG IPESA SILO 9 PES GRAO

Esses produtos são oferecidos como FleetPro, garantindo qualidade e confiabilidade. Além disso, é importante destacar que a estrutura de distribuição da IPESA, fornecedora dos produtos FleetPro, está preparada para atender à demanda mundial, com várias fábricas e centros de distribuição localizados em diferentes regiões.

Você gostaria de saber mais sobre algum desses itens específicos ou como eles podem atender às necessidades do seu cliente? Ou talvez esteja interessado em explorar outras opções de produtos FleetPro que possam ser úteis em conjunto com o silo bolsa?
HUMAN: qual os beneficios do silobag?
AI: Não encontrei essa informação na base FleetPro."
"2026-04-10T19:25:18.590720","teste de reset do feed back da sessão","llama-3.3-70b-versatile","Groq","HUMAN: Vendedor | AI: ✅ Modo **Vendedor de Balcão** ativado. Pode fazer sua pergunta! | HUMAN: cliente precisa de uma peça de trator | AI: Para encontrar a peça de trator FleetPro correta, é importante especificar o equipamento completo, como por exemplo, ""TRACTOR - CASE IH PUMA 150"" ou ""TRACTOR - NEW HOLLAND T8"". Você também pode buscar por número de peça (PN) ou categoria de produto.  Se o cliente estiver procurando por uma peça específica, posso oferecer opções de produtos FleetPro que atendam às necessidades dele. Por exemplo, se for uma peça de transmissão, posso sugerir as Correntes FleetPro, que oferecem a mesma compatibilidade e encaixe da peça original, evitando erros na montagem e contando com apoio técnico e suporte da rede CNH.  Além disso, é importante lembrar que os produtos FleetPro são fabricados por fornecedores homologados e distribuídos com a marca FleetPro, garantindo uma peça de qualidade comprovada e um preço mais competitivo.  Você gostaria de especificar o modelo do trator ou a peça que o cliente está procurando? Isso me ajudará a encontrar a opção FleetPro mais adequada. | HUMAN: me de uma lista dos tratores disponíveis. | AI: Não encontrei essa informação na base FleetPro. | HUMAN: TRACTOR - CASE IH PUMA 150 | AI: Para o Trator Case IH Puma 150, encontrei 10 itens relacionados na base de dados FleetPro. Os produtos incluem:  1. **Vedação traseira - Case - UHMW** com PN FleetPro `47468274FP` 2. **Anel Case** com PN FleetPro `388937FP` 3. **Bucha Case** com PN FleetPro `1313081C1FP` 4. **Sistema de corte Master Cut 20' Case 3020 / NH 740 Caracol** com PN FleetPro `7020-00DSH` 5. **Sistema de corte Master Cut 25' Case 3020 / NH 740 Caracol** com PN FleetPro `7025-00DSH` 6. **Sistema de corte Master Cut 30' Case 3020 / NH 740 Caracol** com PN FleetPro `7030-00DSH` 7. **Sistema de corte Master Cut 35' Case 3020 / NH 740 Caracol** com PN FleetPro `7035-00DSH` 8. **Sistema de corte Master Cut 25' Case 1020 Caracol** com PN FleetPro `7225-00DSH` 9. **Sistema de corte Master Cut 30' Case 1020 Caracol** com PN FleetPro `7230-00DSH` 10. **Sistema de corte Master Cut 35' Case 2020 / 74C Caracol** com PN FleetPro `7335-00DSH`  Esses produtos FleetPro são fabricados por fornecedores homologados e oferecem qualidade e confiabilidade para o seu trator Case IH Puma 150. Além disso, é importante lembrar que os produtos FleetPro são projetados para atender às necessidades específicas das máquinas Case IH e New Holland, garantindo um desempenho ótimo e duradouro.  Se o cliente estiver procurando por outros itens, posso sugerir a verificação de nossos sistemas de corte Master Cut, que oferecem uma ampla gama de opções para diferentes necessidades. Além disso, é sempre uma boa ideia verificar a compatibilidade dos produtos com o trator específico do cliente para garantir a melhor escolha."
"2026-04-10T19:37:01.766401","modelo sem inteligencia nao encontra silobag só silo bolsa","llama-3.3-70b-versatile","Groq","HUMAN: Vendedor | AI: ✅ Modo **Vendedor de Balcão** ativado. Pode fazer sua pergunta! | HUMAN: silobag | AI: Não encontrei essa informação na base FleetPro. | HUMAN: silo bag | AI: Não encontrei essa informação na base FleetPro. | HUMAN: silo bolsa | AI: Encontrei 5 itens relacionados a ""silo bolsa"" na base FleetPro:  1. **SILOBAG IPESA SILO 6 PES** - PN FleetPro: `1860DSH` 2. **SILOBAG IPESA SILO 75 REFOR** - PN FleetPro: `1875DSH` 3. **SILOBAG IPESA SILO 9 PES REFOR** - PN FleetPro: `1890DSH` 4. **SILOBAG IPESA SILO 75 GRAO** - PN FleetPro: `1891DSH` 5. **SILOBAG IPESA SILO 9 PES GRAO** - PN FleetPro: `2952DSH`  Esses produtos são todos da marca FleetPro, fabricados por fornecedores homologados, como o IPESA. Posso ajudar a escolher o produto certo para o seu cliente? Ou gostaria de saber mais sobre as vantagens do FleetPro em relação a outras marcas? Além disso, posso oferecer outros itens em conjunto com a demanda, como lubrificantes FleetPro ou lâminas de corte FleetPro. Qual é o interesse do seu cliente?"
"2026-04-10T19:47:14.232440","modelo nao é inteligente o suficiente","llama-3.3-70b-versatile","Groq","HUMAN: Vendedor | AI: ✅ Modo **Vendedor de Balcão** ativado. Pode fazer sua pergunta! | HUMAN: silo bolsa | AI: Encontrei 5 itens relacionados a ""silo bolsa"" na base de dados FleetPro. Os produtos são:  1. **SILOBAG IPESA SILO 6 PES** - PN FleetPro: `1860DSH` 2. **SILOBAG IPESA SILO 75 REFOR** - PN FleetPro: `1875DSH` 3. **SILOBAG IPESA SILO 9 PES REFOR** - PN FleetPro: `1890DSH` 4. **SILOBAG IPESA SILO 75 GRAO** - PN FleetPro: `1891DSH` 5. **SILOBAG IPESA SILO 9 PES GRAO** - PN FleetPro: `2952DSH`  Esses silos bolsa são fabricados por IPESA e distribuídos como produtos FleetPro. Eles permitem o armazenamento de grãos de forma hermética, mantendo a qualidade dos produtos.  Para o cliente, posso destacar que os silos bolsa FleetPro oferecem uma solução eficaz e confiável para armazenar grãos, com a vantagem de serem herméticos e manter a qualidade dos produtos. Além disso, como produtos FleetPro, eles são fabricados por fornecedores homologados e distribuídos com a marca FleetPro, garantindo qualidade e confiabilidade.  Outros itens que podem ser úteis para o cliente em conjunto com os silos bolsa incluem lubrificantes FleetPro, como os da Petronas, para manter as máquinas agrícolas em boas condições, ou lâminas de corte FleetPro, como as da VV, para manter as lavouras bem cuidadas.  Se o cliente tiver objeções de preço, posso argumentar que os produtos FleetPro oferecem uma relação custo-benefício excelente, considerando a qualidade e a confiabilidade que proporcionam. Além disso, como produtos FleetPro, eles são projetados para ser compatíveis com as máquinas Case IH e New Holland, garantindo uma fácil instalação e manutenção. | HUMAN: silobag | AI: Não encontrei essa informação na base FleetPro."
"2026-04-10T19:51:41.525540","modelo nao inteligente deveria reconhecer silobag","llama-3.3-70b-versatile","Groq","HUMAN: Vendedor | AI: ✅ Modo **Vendedor de Balcão** ativado. Pode fazer sua pergunta! | HUMAN: silobag | AI: Não encontrei essa informação na base FleetPro."
"2026-04-10T19:56:17.662306","silobag chat deveria reconhecer isso como silo bolsa. não sei pq nao reconhece.","llama-3.3-70b-versatile","Groq","HUMAN: Vendedor | AI: ✅ Modo **Vendedor de Balcão** ativado. Pode fazer sua pergunta! | HUMAN: silobag | AI: Não encontrei essa informação na base FleetPro."
"2026-04-10T20:03:55.076536","silobag

Não encontrei essa informação na base FleetPro.

o modelo deveria entender que silobolsa e silobag são a mesma coisa.","llama-3.3-70b-versatile","Groq","HUMAN: Vendedor | AI: ✅ Modo **Vendedor de Balcão** ativado. Pode fazer sua pergunta! | HUMAN: silo bolsa | AI: Olá, posso ajudar com o silo bolsa. Encontrei 5 itens relacionados à sua busca:  - **SILOBAG IPESA SILO 6 PES** com PN FleetPro `1860DSH` - **SILOBAG IPESA SILO 75 REFOR** com PN FleetPro `1875DSH` - **SILOBAG IPESA SILO 9 PES REFOR** com PN FleetPro `1890DSH` - **SILOBAG IPESA SILO 75 GRAO** com PN FleetPro `1891DSH` - **SILOBAG IPESA SILO 9 PES GRAO** com PN FleetPro `2952DSH`  Esses são todos produtos FleetPro, fabricados por fornecedores homologados e distribuídos com a marca FleetPro. O fornecedor desses silos bolsa é a IPESA, e esses produtos são conhecidos como Silobags FleetPro.  Além disso, posso explicar que um silo bolsa é um tubo flexível de polietileno que permite o armazenamento de grãos de forma hermética, mantendo a qualidade dos produtos.  Se o cliente estiver procurando por uma solução para armazenamento de grãos, esses silos bolsa FleetPro podem ser uma ótima opção. E, como estamos falando de produtos FleetPro, podemos destacar a qualidade e a confiabilidade desses itens, fabricados por fornecedores homologados e distribuídos com a marca FleetPro.  Você gostaria de saber mais sobre algum desses itens específicos ou sobre como eles podem atender às necessidades do seu cliente? | HUMAN: silobag | AI: Não encontrei essa informação na base FleetPro."
"2026-04-10T20:10:06.744832","silobag

Não encontrei essa informação na base FleetPro.

Ele deveria saber que silobag é silobolsa, entender pq nao está acontecendo.","llama-3.3-70b-versatile","Groq","HUMAN: Vendedor | AI: ✅ Modo **Vendedor de Balcão** ativado. Pode fazer sua pergunta! | HUMAN: silobag | AI: Não encontrei essa informação na base FleetPro."
"2026-04-10T20:14:07.783409","silobag

Não encontrei essa informação na base FleetPro. deveria saber o que é silobolsa.","llama-3.3-70b-versatile","Groq","HUMAN: Vendedor | AI: ✅ Modo **Vendedor de Balcão** ativado. Pode fazer sua pergunta! | HUMAN: silobag | AI: Não encontrei essa informação na base FleetPro."
"2026-04-14T16:41:15.967178","ddd","N/A","N/A",""
"2026-04-14T16:41:20.987712","ddd","N/A","N/A",""
"2026-04-14T16:41:47.538786","dddsd","N/A","N/A","HUMAN: sdsdsd | AI: ⚙️ Nenhum modelo de linguagem inicializado.  Para perguntas e recomendações, configure o LLM na sidebar (**Modelo de Linguagem**) e clique em **Inicializar Agente**.  Para buscar um PN diretamente, basta digitar o número da peça."
"2026-04-14T16:53:10.746385","dddsd","N/A","N/A","HUMAN: sdsdsd | AI: ⚙️ Nenhum modelo de linguagem inicializado.  Para perguntas e recomendações, configure o LLM na sidebar (**Modelo de Linguagem**) e clique em **Inicializar Agente**.  Para buscar um PN diretamente, basta digitar o número da peça."
"2026-04-14T16:56:21.767125","dddsd","N/A","N/A","HUMAN: sdsdsd | AI: ⚙️ Nenhum modelo de linguagem inicializado.  Para perguntas e recomendações, configure o LLM na sidebar (**Modelo de Linguagem**) e clique em **Inicializar Agente**.  Para buscar um PN diretamente, basta digitar o número da peça. | HUMAN: Vendedor | AI: ✅ Modo **Vendedor de Balcão** ativado. Pode fazer sua pergunta!"
"2026-04-14T17:14:47.345586","ddd","N/A","N/A","HUMAN: Vendedor | AI: ✅ Modo **Vendedor de Balcão** ativado. Pode fazer sua pergunta!"
